{
  "$schema": "../schemas/exemptions.schema.json",
  "notes": "Actions: antiSpam, massGuard, permDiff, autoRestore, botGuard, ownerProtection. Use \"*\" for all actions.",
  "users": {
    "1378113490040000622": ["*"]
  },
  "roles": {},
  "guilds": {
    "1386322665635184680": {
      "users": {},
      "roles": {}
    }
  }
}
